{
  "status": "insufficient_data",
  "answer_text": "",
  "clarification_prompt": "Tôi chưa tìm thấy thủ tục phù hợp với câu hỏi của bạn. Bạn có thể mô tả rõ hơn thủ tục hoặc thông tin bạn cần không?",
  "citations": [],
  "evidence_bundle_id": "BUNDLE-SAMPLE-LOW",
  "created_at": "2026-09-28T00:00:00Z"
}
