{
  "status": "clarification_needed",
  "answer_text": "",
  "clarification_prompt": "Bạn muốn hỏi về thủ tục nào: “Cấp đổi thẻ căn cước công dân” hoặc “Cấp thẻ căn cước công dân lần đầu”?",
  "citations": [],
  "evidence_bundle_id": "BUNDLE-SAMPLE-AMBIGUOUS",
  "created_at": "2026-09-28T00:00:00Z"
}
